{
  "schema_version": "policy_translation_approval.v1",
  "proposal_id": "policy-translation-proposal-03131ebb6c264b8e21e6cfc250229acec6872632879d1b26193d069f1951b3be",
  "proposal_hash": "sha256:03131ebb6c264b8e21e6cfc250229acec6872632879d1b26193d069f1951b3be",
  "confirmation_hash": "sha256:e4fce367cb451d1ac0204df094ea63b1c74bbef6553fa1a68d1474a5ac14aae9",
  "review_hash": "sha256:9d1cfec0b642b3ddee6eb2ed2976a987e9a68099e8ffcb8676e296e95cb24be2",
  "source_policy_ref": "repository-policy@revision-1",
  "source_snapshot_hash": "sha256:ff5601216d1505cc8d8c9fb73fe3276d3a7852a083f302e8767e592ca1b3727f",
  "authority_ref": "repository-create-only@2.0.0",
  "capability_catalog": {
    "catalog_id": "waveframe.coding-agent.repository-change",
    "catalog_version": "2.0.0",
    "catalog_hash": "sha256:8530e82761a333c5e7e8cc0ccb0b2949310ea91b470d548613c98078896f030a"
  },
  "coverage": {
    "total_clause_count": 3,
    "enforced_clause_count": 3,
    "unenforced_clause_count": 0,
    "unresolved_clause_count": 0,
    "fully_represented_clause_count": 3,
    "partially_represented_clause_count": 0,
    "entirely_unsupported_clause_count": 0,
    "informational_clause_count": 0,
    "unrepresented_clause_count": 0,
    "enforced_clause_ids": [
      "policy-clause-2532c0e8dca3a40a13b50b15eb50173c9deb85dae6b33a476b437fa66e5f122e",
      "policy-clause-e9f35596a2e42d45817b4d363668a20e268c145e5e87b758444b6d3a1f2e8743",
      "policy-clause-f7d301eec705aaa85360a4ddcc91d197d96136302e75c1731ed6d8656b683e22"
    ],
    "unenforced_clause_ids": [],
    "acknowledged_unrepresented_clause_ids": [],
    "total_control_count": 3,
    "confirmed_control_count": 3,
    "unresolved_control_count": 0,
    "confirmed_control_ids": [
      "candidate-control-032425c1ae5101f30389f31f2cbf00f74d4717dc553a43668cd756bdf58ebe5d",
      "candidate-control-64b8eedf5747098ba739c3083f900db9b639f81d9f35d9082ae7426ddf0fd9ef",
      "candidate-control-dfe5ff45ba28b31f7f598cd655c2cb4e4e329f9405aa8b9b22b82defea95154d"
    ],
    "unresolved_control_ids": []
  },
  "approved_by": "policy-owner",
  "approved_at": "2026-09-11T12:03:00Z",
  "approval_id": "policy-translation-approval-299ba91a5b9a0b269e37bf311ef24da3bf2610dda6f82cdaf856bb32f0d96f43",
  "approval_hash": "sha256:299ba91a5b9a0b269e37bf311ef24da3bf2610dda6f82cdaf856bb32f0d96f43"
}
