{
  "schema_version": "policy_translation_approval.v1",
  "proposal_id": "policy-translation-proposal-02ed8823aae450d7b4ec81e83a742768f6cf8c90184315262a73c84392022b62",
  "proposal_hash": "sha256:02ed8823aae450d7b4ec81e83a742768f6cf8c90184315262a73c84392022b62",
  "confirmation_hash": "sha256:7e5d802e8d310d95bd66c5fac062ec636751cd954593e5bf0269247373be4fc5",
  "review_hash": "sha256:9fea9b9ba612922d90cde6b223d9b77698a7ac1dc4babfdd69af060a8301c014",
  "source_policy_ref": "repository-policy@revision-1",
  "source_snapshot_hash": "sha256:ff5601216d1505cc8d8c9fb73fe3276d3a7852a083f302e8767e592ca1b3727f",
  "authority_ref": "repository-create-only@3.0.0",
  "capability_catalog": {
    "catalog_id": "waveframe.coding-agent.repository-change",
    "catalog_version": "3.0.0",
    "catalog_hash": "sha256:bd7fd23eb59b5521ef6780edec0667ce9b7ba9b5738dfa2701a575fb3efce930"
  },
  "coverage": {
    "total_clause_count": 3,
    "enforced_clause_count": 3,
    "unenforced_clause_count": 0,
    "unresolved_clause_count": 0,
    "fully_represented_clause_count": 3,
    "partially_represented_clause_count": 0,
    "entirely_unsupported_clause_count": 0,
    "informational_clause_count": 0,
    "unrepresented_clause_count": 0,
    "enforced_clause_ids": [
      "policy-clause-2532c0e8dca3a40a13b50b15eb50173c9deb85dae6b33a476b437fa66e5f122e",
      "policy-clause-e9f35596a2e42d45817b4d363668a20e268c145e5e87b758444b6d3a1f2e8743",
      "policy-clause-f7d301eec705aaa85360a4ddcc91d197d96136302e75c1731ed6d8656b683e22"
    ],
    "unenforced_clause_ids": [],
    "acknowledged_unrepresented_clause_ids": [],
    "total_control_count": 3,
    "confirmed_control_count": 3,
    "unresolved_control_count": 0,
    "confirmed_control_ids": [
      "candidate-control-86d477148f61eeb5547411efbfce9ce60edb311d854eacb6515cd24640901a89",
      "candidate-control-acfa80e799e3db5661214bd4b2c2a48275a0621af0a5963356d7436174ffa254",
      "candidate-control-b07470f68f684c3b72de6d9b8771418fd9794e4b7e41ccfae4155b604c08fe76"
    ],
    "unresolved_control_ids": []
  },
  "approved_by": "example-release-policy-owner",
  "approved_at": "2026-09-12T12:03:00Z",
  "approval_id": "policy-translation-approval-83daa65cc3d1ee294f71df2acb76ae90fa7a82e09ae72da8ae825cd16901aac5",
  "approval_hash": "sha256:83daa65cc3d1ee294f71df2acb76ae90fa7a82e09ae72da8ae825cd16901aac5"
}
